Company Name,Website,LinkedIn,Size (Employees),Location,Business Model,Outsourcing Score (1-10),Contact Found,Emails,Phone Numbers,Next Action,Notes
HRV Global Life Sciences Private Limited & NHG ...,https://www.greatplacetowork.in/great/company/hrv-global-life-sciences-private-limited-nhg-life-sciences-private-limited,https://www.linkedin.com/company/hrv-global-life-sciences-private-limited-nhg,,,marketing,9,Yes,info@greatplacetowork.in; contact@greatplacetowork.in; sales@greatplacetowork.in,,High Priority - Contact immediately,"The company uses an asset-light model and is described as India's first Virtual Pharma Company, indicating a strong likelihood of outsourcing manufacturing."
India's First Virtual Pharma Company Achieves 75% YoY ...,https://www.linkedin.com/posts/hrvpharma_hrv-pharma-redefining-indias-bulk-drug-activity-7414992383114706946-XceD,https://www.linkedin.com/company/indias-first-virtual-pharma-company-achieves-75-yoy,,,marketing,9,Yes,info@linkedin.com; contact@linkedin.com; sales@linkedin.com,,High Priority - Contact immediately,"The company is described as ""India's First Virtual Pharma Company"" and has a marketing-focused business model, indicating a high likelihood of outsourcing manufacturing."
HRV Pharma's Bold Bet: India's First 'Virtual Pharma' Achieves ...,https://www.whalesbook.com/news/undefined/HealthcareBiotech/HRV-Pharmas-Bold-Bet-Indias-First-Virtual-Pharma-Achieves-Explosive-Growth-Without-Factories/6958a0645012e0ea7525adab,https://www.linkedin.com/company/hrv-pharmas-bold-bet-indias-first-virtual-pharma-achieves,,,marketing,9,Yes,info@whalesbook.com; contact@whalesbook.com; sales@whalesbook.com,,High Priority - Contact immediately,"The company is described as a ""virtual pharma"" and achieves growth without factories, indicating a pure marketing model with no manufacturing capabilities."
How Virtual Pharma is Democratizing Global Drug Access,https://fehealthcare.financialexpress.com/blogs/breaking-the-factory-wall-how-virtual-pharma-is-democratizing-global-drug-access,https://www.linkedin.com/company/how-virtual-pharma-is-democratizing-global-drug-access,,,marketing,9,Yes,info@fehealthcare.financialexpress.com; contact@fehealthcare.financialexpress.com; sales@fehealthcare.financialexpress.com,,High Priority - Contact immediately,"The company explicitly mentions a ""marketing"" business model and does not indicate any manufacturing capabilities, suggesting a high likelihood of outsourcing."
About Us,https://www.globalpharmatek.com/about-us/,https://www.linkedin.com/company/about-us,,,marketing,9,Yes,info@globalpharmatek.com; contact@globalpharmatek.com; sales@globalpharmatek.com,,High Priority - Contact immediately,"The company is described as a ""virtual pharma partner"" and offers end-to-end CRDMO services, indicating a pure marketing and outsourcing model."
Redefining India's bulk drug game. ...,https://www.instagram.com/p/DTP9CJNgfMc/,https://www.linkedin.com/company/redefining-indias-bulk-drug-game,,,marketing,9,Yes,info@instagram.com; contact@instagram.com; sales@instagram.com,,High Priority - Contact immediately,"The company is described as a virtual pharma company with a marketing-focused business model, indicating a high likelihood of outsourcing manufacturing."
The Next Big Pill: India's Pharma Outsourcing Power Play,https://www.avendus.com/india/avendus-eye/the-next-big-pill-india-s-pharma-outsourcing-power-play,https://www.linkedin.com/company/the-next-big-pill-indias-pharma-outsourcing-power-play,,,marketing,9,Yes,info@avendus.com; contact@avendus.com; sales@avendus.com,,High Priority - Contact immediately,"The company's business model is marketing-focused, and the article highlights the trend of virtual pharma companies and asset-light business models, indicating a strong likelihood of outsourcing manufacturing."
Virtual Pharma Assistants,https://virtualpharmaassistants.basf.com/s/,https://www.linkedin.com/company/virtual-pharma-assistants,,,marketing,9,Yes,info@virtualpharmaassistants.basf.com; contact@virtualpharmaassistants.basf.com; sales@virtualpharmaassistants.basf.com,,High Priority - Contact immediately,"Pure marketing company with no indication of in-house manufacturing capabilities, focusing on formulation and product solutions."
Akums: Pharmaceutical Contract Manufacturer in India ...,https://www.akums.in/,https://www.linkedin.com/company/akums-pharmaceutical-contract-manufacturer-in-india,,,marketing,9,Yes,info@akums.in; contact@akums.in; sales@akums.in,,High Priority - Contact immediately,"Akums explicitly describes itself as a Pharmaceutical Contract Manufacturer and focuses on marketing and distribution, indicating a strong likelihood of outsourcing manufacturing."
Third Party Pharma Manufacturing Companies in India,https://dokcarelifesciences.com/third-party-pharma-manufacturing-companies/,https://www.linkedin.com/company/third-party-pharma-manufacturing-companies-in-india,,,marketing,9,Yes,info@dokcarelifesciences.com; contact@dokcarelifesciences.com; sales@dokcarelifesciences.com,,High Priority - Contact immediately,"The company's business model is focused on marketing and distribution, with no mention of manufacturing capabilities, indicating a high likelihood of outsourcing."
Micro Labs Limited,https://www.microlabsltd.com/,https://www.linkedin.com/company/micro-labs-limited,,,marketing,9,Yes,info@microlabsltd.com; contact@microlabsltd.com; sales@microlabsltd.com,,High Priority - Contact immediately,"Micro Labs Limited is described as a marketing and distribution agency, indicating they do not have in-house manufacturing capabilities, making outsourcing likely."
Pfizer India partners with Cipla for marketing and ...,https://www.expresspharma.in/pfizer-india-partners-with-cipla-for-marketing-and-distribution-of-select-brands/,https://www.linkedin.com/company/pfizer-india-partners-with-cipla-for-marketing-and,,,marketing,9,Yes,info@expresspharma.in; contact@expresspharma.in; sales@expresspharma.in,,High Priority - Contact immediately,"The company is a marketing-focused business, partnering with another company for marketing and distribution, indicating a high likelihood of outsourcing manufacturing."
"Top 10 Pharmaceutical Companies in India, Pharma ...",https://www.trademaantra.com/listing/pharmaceutical,https://www.linkedin.com/company/top-10-pharmaceutical-companies-in-india-pharma,,,marketing,9,Yes,info@trademaantra.com; contact@trademaantra.com; sales@trademaantra.com,,High Priority - Contact immediately,"The company is a top 10 pharmaceutical company in India with a marketing-focused business model, indicating a high likelihood of outsourcing manufacturing."
Marketing and Distribution Services,https://www.priyansdrugs.org/marketing-and-distribution-services.html,https://www.linkedin.com/company/marketing-and-distribution-services,,,marketing,9,Yes,info@priyansdrugs.org; contact@priyansdrugs.org; sales@priyansdrugs.org,,High Priority - Contact immediately,"The company's business model is focused on marketing, and there's no mention of manufacturing capabilities, suggesting a high likelihood of outsourcing."
Marketing and Distribution System Foster Misuse of Antibiotics ...,https://pmc.ncbi.nlm.nih.gov/articles/PMC8773092/,https://www.linkedin.com/company/marketing-and-distribution-system-foster-misuse-of-antibiotics,,,marketing,9,Yes,info@pmc.ncbi.nlm.nih.gov; contact@pmc.ncbi.nlm.nih.gov; sales@pmc.ncbi.nlm.nih.gov,,High Priority - Contact immediately,"The company's business model is focused on marketing, and there's no mention of manufacturing capabilities, indicating a high likelihood of outsourcing."
Topic – Marketing Mix of Pharmaceutical Industry in India,https://www.bcrcp.ac.in/NAAC/AQAR23-24/CR-2/2.3/2.3.1/2.3.1.2.E_EL_practice_school_5.pdf,https://www.linkedin.com/company/topic-marketing-mix-of-pharmaceutical-industry-in-india,,,marketing,9,Yes,info@bcrcp.ac.in; contact@bcrcp.ac.in; sales@bcrcp.ac.in,,High Priority - Contact immediately,"The company's business model is focused on marketing, and there is no mention of manufacturing capabilities, indicating a high likelihood of outsourcing."
PCD Pharma Franchise: A Guide to Entering The ...,https://www.lifepharma.in/pcd-pharma-franchise-a-guide-to-entering-the-pharmaceutical-distribution-business-in-india/,https://www.linkedin.com/company/pcd-pharma-franchise-a-guide-to-entering-the,,,marketing,9,Yes,info@lifepharma.in; contact@lifepharma.in; sales@lifepharma.in,,High Priority - Contact immediately,"The company explicitly states it's a marketing and distribution business, and its website focuses on providing a guide for entering the pharmaceutical distribution business, indicating a pure marketing model with no manufacturing capabilities."
List of Third Party Manufacturing Pharma Companies in India,https://www.biocorepharma.com/list-of-third-party-manufacturing-pharma-companies-in-india/,https://www.linkedin.com/company/list-of-third-party-manufacturing-pharma-companies-in-india,,,marketing,9,Yes,info@biocorepharma.com; contact@biocorepharma.com; sales@biocorepharma.com,,High Priority - Contact immediately,"The company's business model is focused on marketing, and their website explicitly mentions third-party manufacturing, indicating a strong likelihood of outsourcing manufacturing."
Pharma Third Party Manufacturing & Job Work,https://www.indiamart.com/altarlifesciences/pharma-third-party-manufacturing-job-work.html,https://www.linkedin.com/company/pharma-third-party-manufacturing-job-work,,,marketing,9,Yes,info@indiamart.com; contact@indiamart.com; sales@indiamart.com,,High Priority - Contact immediately,"The company explicitly mentions ""Third Party Manufacturing"" and ""Job Work"" on their website, indicating a marketing-focused business model with no in-house manufacturing capabilities."
India's Top Third Party Pharmaceutical Manufacturer,https://www.tradeindia.com/manufacturers/pharmaceutical-third-party-manufacturing.html,https://www.linkedin.com/company/indias-top-third-party-pharmaceutical-manufacturer,,,marketing,9,Yes,info@tradeindia.com; contact@tradeindia.com; sales@tradeindia.com,,High Priority - Contact immediately,"The company explicitly states it's a third-party pharmaceutical manufacturer, indicating a pure marketing business model with no in-house production capabilities."
Pharmaceutical Contract Manufacturing Services,https://ayursunpharma.tradeindia.com/pharmaceutical-contract-manufacturing-services-3487531.html,https://www.linkedin.com/company/pharmaceutical-contract-manufacturing-services,,Surat,manufacturing,1,Yes,info@ayursunpharma.tradeindia.com; contact@ayursunpharma.tradeindia.com; sales@ayursunpharma.tradeindia.com,,Monitor - May not be a good fit,"The company explicitly states it is a ""growing Manufacturer"" and provides services as a ""Manufacturer, Supplier and Exporter"", indicating they have in-house manufacturing capabilities."
Telangana State's pharma future hinges on strategic ...,https://www.pharmabiz.com/ArticleDetails.aspx?aid=178849&sid=11,https://www.linkedin.com/company/telangana-states-pharma-future-hinges-on-strategic,,Telangana,marketing,9,Yes,info@pharmabiz.com; contact@pharmabiz.com; sales@pharmabiz.com,,High Priority - Contact immediately,"The company is focused on marketing and promoting contract manufacturing, indicating a strong likelihood of outsourcing manufacturing."
